"variableName","variableLongName","variableVocab","deprecated","unit","unitLongName","unitVocab"
"FLUORESCENCE_CHLA","Raw fluorescence signal (count) from chlorophyll-a fluorometer.","http://vocab.nerc.ac.uk/collection/OG1/current/FLUOCHLA/","false","Dmnless","Dimensionless","http://vocab.nerc.ac.uk/collection/P06/current/UUUU/"
"TEMP_CPU_FLUOR_BACKSC","The raw analogue-to-digital converter output from a temperature sensor mounted on a CPU that is a component part of a backscattering meter and/or fluorometer.","http://vocab.nerc.ac.uk/collection/OG1/current/TCPUCHLA/","false","Dmnless","Dimensionless","http://vocab.nerc.ac.uk/collection/P06/current/UUUU/"
"RAW_BACKSCATTERING700","Raw backscattering sensor signal (count) at 700 nm wavelength. Volume scattering scale factor has not been applied.","http://vocab.nerc.ac.uk/collection/OG1/current/RBBP700/","false","Dmnless","Dimensionless","http://vocab.nerc.ac.uk/collection/P06/current/UUUU/"
"NB_SAMPLE","Number of values included in the determination of a statistic such as an average.","http://vocab.nerc.ac.uk/collection/OG1/current/NBSAMP/","false","Dmnless","Dimensionless","http://vocab.nerc.ac.uk/collection/P06/current/UUUU/"
"COUNT_DOXY","The raw output from a dissolved oxygen sensor such as an SBE43 with output converted from voltage or frequency into counts by an ADC.","http://vocab.nerc.ac.uk/collection/OG1/current/CNTDOXY/","false","Dmnless","Dimensionless","http://vocab.nerc.ac.uk/collection/P06/current/UUUU/"
"GLIDER_PITCH_MASS_POSITION_COUNT","The pitch A/D count position of a glider internal mass.","http://vocab.nerc.ac.uk/collection/OG1/current/PITMPOS/","false","Dmnless","Dimensionless","http://vocab.nerc.ac.uk/collection/P06/current/UUUU/"
"DOXY","Concentration of dissolved oxygen per unit mass of the water column. Oxygen may be expressed in terms of mass, volume or quantity of substance.","http://vocab.nerc.ac.uk/collection/OG1/current/DOXY/","false","umol/kg","Micromoles per kilogram","http://vocab.nerc.ac.uk/collection/P06/current/KGUM/"
"MLPL_DOXY","Concentration of dissolved oxygen per unit volume of the water column. Oxygen may be expressed in terms of mass, volume or quantity of substance.","http://vocab.nerc.ac.uk/collection/OG1/current/MLPLDOXY/","false","ml/l","Millilitres per litre","http://vocab.nerc.ac.uk/collection/P06/current/UMLL/"
"DISTANCE_ALTIMETER","Distance in meters from the transducer face to the target.","http://vocab.nerc.ac.uk/collection/OG1/current/DIST_ALT/","false","m","Metres","http://vocab.nerc.ac.uk/collection/P06/current/ULAA/"
"GLIDER_DEPTH","Depth below surface of the water body by unknown instrument and correction to zero at sea level using unspecified algorithm.","http://vocab.nerc.ac.uk/collection/OG1/current/DEPTH/","false","m","Metres","http://vocab.nerc.ac.uk/collection/P06/current/ULAA/"
"ALTITUDE","The vertical distance of a platform above the bed surface of a water body.","http://vocab.nerc.ac.uk/collection/OG1/current/ALTITUDE/","false","m","Metres","http://vocab.nerc.ac.uk/collection/P06/current/ULAA/"
"CHLA","In-situ fluorometer with either manufacturer, laboratory or sample calibration applied.","http://vocab.nerc.ac.uk/collection/OG1/current/CHLA/","false","mg/m^3","Milligrams per cubic metre","http://vocab.nerc.ac.uk/collection/P06/current/UMMC/"
"TEMP","Temperature of the water body by CTD or STD","http://vocab.nerc.ac.uk/collection/OG1/current/TEMP/","false","degC","Degrees Celsius","http://vocab.nerc.ac.uk/collection/P06/current/UPAA/"
