"variableName","variableLongName","variableVocab","deprecated","unit","unitLongName","unitVocab"
"BBP880","Particle backscattering at 880 nanometers.","http://vocab.nerc.ac.uk/collection/OG1/current/BBP880/","false","/m","per metre","http://vocab.nerc.ac.uk/collection/P06/current/UPRM/"
"DOWNWELLING_PAR","Downwelling vector irradiance as energy of electromagnetic radiation (PAR wavelengths) in the water body by cosine-collector radiometer.","http://vocab.nerc.ac.uk/collection/OG1/current/DPAR/","false","uE/m^2/s","MicroEinsteins per square metre per second","http://vocab.nerc.ac.uk/collection/P06/current/UMES/"
"BBP","Particle backscattering at a specified optical wavelength.","http://vocab.nerc.ac.uk/collection/OG1/current/BBP/","false","/m","per metre","http://vocab.nerc.ac.uk/collection/P06/current/UPRM/"
"PPOX_DOXY","The pressure that the oxygen component of an atmosphere sample would have if it alone occupied the same volume at the same temperature as the sample.","http://vocab.nerc.ac.uk/collection/OG1/current/PPOXDOXY/","false","mBar","Millibars","http://vocab.nerc.ac.uk/collection/P06/current/UPBB/"
"BETA_BACKSCATTERING880","Total angle specific volume from backscattering sensor at 880 nanometers.","http://vocab.nerc.ac.uk/collection/OG1/current/BETA880/","false","/m/sr","per metre per steradian","http://vocab.nerc.ac.uk/collection/P06/current/PMSR/"
"DOWN_IRRADIANCE412","The vertical component of light at 412nm wavelength travelling downwards.","http://vocab.nerc.ac.uk/collection/OG1/current/ED412/","false","W/m^2/nm","Watts per square metre per nanometre","http://vocab.nerc.ac.uk/collection/P06/current/UWNM/"
"BETA_BACKSCATTERING650","Total angle specific volume from backscattering sensor at 650 nanometers.","http://vocab.nerc.ac.uk/collection/OG1/current/BETA650/","false","/m/sr","per metre per steradian","http://vocab.nerc.ac.uk/collection/P06/current/PMSR/"
"WATERCURRENTS_U","The depth-averaged current in the x-axis using dead reckoning between two surfacings.","http://vocab.nerc.ac.uk/collection/OG1/current/WCUR_X/","false","cm/s","Centimetres per second","http://vocab.nerc.ac.uk/collection/P06/current/UVBB/"
"DOWN_IRRADIANCE443","The vertical component of light at 443nm wavelength travelling downwards.","http://vocab.nerc.ac.uk/collection/OG1/current/ED443/","false","W/m^2/nm","Watts per square metre per nanometre","http://vocab.nerc.ac.uk/collection/P06/current/UWNM/"
"BETA_BACKSCATTERING","Total angle specific volume from backscattering sensor at unspecified wavelength.","http://vocab.nerc.ac.uk/collection/OG1/current/BETABBP/","false","/m/sr","per metre per steradian","http://vocab.nerc.ac.uk/collection/P06/current/PMSR/"
"PRES","Pressure (spatial co-ordinate) exerted by the water body by profiling pressure sensor and corrected to read zero at sea level","http://vocab.nerc.ac.uk/collection/OG1/current/PRES/","false","dbar","Decibars","http://vocab.nerc.ac.uk/collection/P06/current/UPDB/"
"LONGITUDE_GPS","Longitude east by unspecified GPS system.","http://vocab.nerc.ac.uk/collection/OG1/current/LON_GPS/","false","degree_east","Degrees east","http://vocab.nerc.ac.uk/collection/P06/current/DEGE/"
"BBP700","Particle backscattering at 700 nanometers.","http://vocab.nerc.ac.uk/collection/OG1/current/BBP700/","false","/m","per metre","http://vocab.nerc.ac.uk/collection/P06/current/UPRM/"
"GLIDER_RELATIVE_VBD","The difference between the volume of the internal variable buoyancy device (VBD) on a glider and the volume of the VBD that would maintain neutral buoyancy. If values are positive then the glider rises in the water.","http://vocab.nerc.ac.uk/collection/OG1/current/RELVBD/","false","cm^3","Cubic centimetres","http://vocab.nerc.ac.uk/collection/P06/current/VVCC/"
"OIL_VOL","The volume of oil in the external reservoir of the platform. A positive change in OIL_VOL represents moving oil from the internal reservoir (within the pressure casing) to the external reservoir, increasing the total volume of the platform.","http://vocab.nerc.ac.uk/collection/OG1/current/OIL_VOL/","false","cm^3","Cubic centimetres","http://vocab.nerc.ac.uk/collection/P06/current/VVCC/"
"PRES_ENG","Pressure (spatial co-ordinate) exerted by the water body by non temperature compensated platform pressure sensor and corrected to read zero at sea level.","http://vocab.nerc.ac.uk/collection/OG1/current/PRES_ENG/","false","dbar","Decibars","http://vocab.nerc.ac.uk/collection/P06/current/UPDB/"
"BETA_BACKSCATTERING470","Total angle specific volume from backscattering sensor at 470 nanometers.","http://vocab.nerc.ac.uk/collection/OG1/current/BETA470/","false","/m/sr","per metre per steradian","http://vocab.nerc.ac.uk/collection/P06/current/PMSR/"
"WATERCURRENTS_V","The depth-averaged current in the y-axis using dead reckoning between two surfacings.","http://vocab.nerc.ac.uk/collection/OG1/current/WCUR_Y/","false","cm/s","Centimetres per second","http://vocab.nerc.ac.uk/collection/P06/current/UVBB/"
"DOWN_IRRADIANCE655","The vertical component of light at 655nm wavelength travelling downwards.","http://vocab.nerc.ac.uk/collection/OG1/current/ED655/","false","W/m^2/nm","Watts per square metre per nanometre","http://vocab.nerc.ac.uk/collection/P06/current/UWNM/"
"LATITUDE","Latitude north.","http://vocab.nerc.ac.uk/collection/OG1/current/LAT/","false","degree_north","Degrees north","http://vocab.nerc.ac.uk/collection/P06/current/DEGN/"
"BBP470","Particle backscattering at 470 nanometers.","http://vocab.nerc.ac.uk/collection/OG1/current/BBP470/","false","/m","per metre","http://vocab.nerc.ac.uk/collection/P06/current/UPRM/"
"DOWN_IRRADIANCE555","The vertical component of light at 555nm wavelength travelling downwards.","http://vocab.nerc.ac.uk/collection/OG1/current/ED555/","false","W/m^2/nm","Watts per square metre per nanometre","http://vocab.nerc.ac.uk/collection/P06/current/UWNM/"
"BETA_BACKSCATTERING532","Total angle specific volume from backscattering sensor at 532 nanometers.","http://vocab.nerc.ac.uk/collection/OG1/current/BETA532/","false","/m/sr","per metre per steradian","http://vocab.nerc.ac.uk/collection/P06/current/PMSR/"
"PHASE","Derived from the glider's engineering state, glider phase reflects the state of glider behaviour. Accepted values range from 0 - 7, with the definitions available at: https://github.com/OceanGlidersCommunity/OG-format-user-manual/blob/main/vocabularyCollection/phase_translation_tables.md.","http://vocab.nerc.ac.uk/collection/OG1/current/PHASE/","false","NA","Not applicable","http://vocab.nerc.ac.uk/collection/P06/current/XXXX/"
"TIME_FROM_YO_START","Time elapsed since since start of glider yo.","http://vocab.nerc.ac.uk/collection/OG1/current/TIMEYO/","false","s","Seconds","http://vocab.nerc.ac.uk/collection/P06/current/UTBB/"
"DOWN_IRRADIANCE","The vertical component of light at the specified wavelength travelling downwards.","http://vocab.nerc.ac.uk/collection/OG1/current/ED/","false","W/m^2/nm","Watts per square metre per nanometre","http://vocab.nerc.ac.uk/collection/P06/current/UWNM/"
"VOLTAGE_DOXY","The raw output from a dissolved oxygen sensor such as an SBE43 with output as a voltage related to DO concentration.","http://vocab.nerc.ac.uk/collection/OG1/current/VLTDOXY/","false","V","Volts","http://vocab.nerc.ac.uk/collection/P06/current/UVLT/"
"LATITUDE_GPS","Latitude north by unspecified GPS system.","http://vocab.nerc.ac.uk/collection/OG1/current/LAT_GPS/","false","degree_north","Degrees north","http://vocab.nerc.ac.uk/collection/P06/current/DEGN/"
"CONFIGURED_GLIDER_PITCH_MASS_POSITION","The distance of a glider's internal pitch mass from the position that would maintain neutral pitch (Positive nose up).","http://vocab.nerc.ac.uk/collection/OG1/current/CPITMPOS/","false","cm","Centimetres","http://vocab.nerc.ac.uk/collection/P06/current/ULCM/"
"TIME_SINCE_MIDNIGHT_OF_CURRENT_DAY","Time elapsed since since start of day.","http://vocab.nerc.ac.uk/collection/OG1/current/TIMEDF/","false","s","Seconds","http://vocab.nerc.ac.uk/collection/P06/current/UTBB/"
"DOWN_IRRADIANCE532","The vertical component of light at 532nm wavelength travelling downwards.","http://vocab.nerc.ac.uk/collection/OG1/current/ED532/","false","W/m^2/nm","Watts per square metre per nanometre","http://vocab.nerc.ac.uk/collection/P06/current/UWNM/"
"DOWN_IRRADIANCE490","The vertical component of light at 490nm wavelength travelling downwards.","http://vocab.nerc.ac.uk/collection/OG1/current/ED490/","false","W/m^2/nm","Watts per square metre per nanometre","http://vocab.nerc.ac.uk/collection/P06/current/UWNM/"
"BETA_BACKSCATTERING700","Total angle specific volume from backscattering sensor at 700 nanometers.","http://vocab.nerc.ac.uk/collection/OG1/current/BETA700/","false","/m/sr","per metre per steradian","http://vocab.nerc.ac.uk/collection/P06/current/PMSR/"
"PP_DOXY","The partial pressure of oxygen in air in equilibrium with a water sample.","http://vocab.nerc.ac.uk/collection/OG1/current/PPDOXY/","false","mBar","Millibars","http://vocab.nerc.ac.uk/collection/P06/current/UPBB/"
"MOLAR_DOXY","Water body dissolved oxygen concentration expressed at zero rather than in-situ salinity. This is NOT an environment state variable.","http://vocab.nerc.ac.uk/collection/OG1/current/MOLDOXY/","false","mmol/l","Millimoles per litre","http://vocab.nerc.ac.uk/collection/P06/current/MMPL/"
"CNDC","Electrical conductivity of the water body by CTD","http://vocab.nerc.ac.uk/collection/OG1/current/CNDC/","false","S/m","Siemens per metre","http://vocab.nerc.ac.uk/collection/P06/current/UECA/"
"PHASE_DELAY_DOXY","Phase delay reported by oxygen sensor.","http://vocab.nerc.ac.uk/collection/OG1/current/PHDEDOXY/","false","us","Microseconds","http://vocab.nerc.ac.uk/collection/P06/current/USEC/"
"TEMP_VOLTAGE_DOXY","Voltage of instrument output by in-situ thermistor","http://vocab.nerc.ac.uk/collection/OG1/current/TVLTDOXY/","false","V","Volts","http://vocab.nerc.ac.uk/collection/P06/current/UVLT/"
"SIDE_SCATTERING_TURBIDITY","Turbidity signal from side scattering sensor.","http://vocab.nerc.ac.uk/collection/OG1/current/NCNTTUR1/","false",NA,NA,NA
"BBP650","Particle backscattering at 650 nanometers.","http://vocab.nerc.ac.uk/collection/OG1/current/BBP650/","false","/m","per metre","http://vocab.nerc.ac.uk/collection/P06/current/UPRM/"
"TIME","Time elapsed since 1970-01-01T00:00:00Z.","http://vocab.nerc.ac.uk/collection/OG1/current/TIME/","false","s","Seconds","http://vocab.nerc.ac.uk/collection/P06/current/UTBB/"
"CDOM","The quantity of coloured organic compounds in solution in unit volume of any body of water.","http://vocab.nerc.ac.uk/collection/OG1/current/CDOM/","false","ppb","Parts per billion","http://vocab.nerc.ac.uk/collection/P06/current/UPPB/"
"PHYCOCYANIN","Phycocyanin concentration per unit volume of fresh or salt water.","http://vocab.nerc.ac.uk/collection/OG1/current/PHYCOCYANIN/","false","ng/l","Nanograms per litre","http://vocab.nerc.ac.uk/collection/P06/current/UNGL/"
"BBP412","Particle backscattering at 412 nanometers.","http://vocab.nerc.ac.uk/collection/OG1/current/BBP412/","false","/m","per metre","http://vocab.nerc.ac.uk/collection/P06/current/UPRM/"
"TURBIDITY","Estimate of suspended sediment concentration based on the proportion of a light transmission in the water column that is reflected back to a co-located receiver.","http://vocab.nerc.ac.uk/collection/OG1/current/TURB/","false",NA,NA,NA
"FREQUENCY_DOXY","The raw output from a dissolved oxygen sensor such as an SBE43 with output as a frequency related to DO concentration.","http://vocab.nerc.ac.uk/collection/OG1/current/FREQDOXY/","false","Hz","Hertz","http://vocab.nerc.ac.uk/collection/P06/current/UTHZ/"
"BBP715","Particle backscattering at 715 nanometers.","http://vocab.nerc.ac.uk/collection/OG1/current/BBP715/","false","/m","per metre","http://vocab.nerc.ac.uk/collection/P06/current/UPRM/"
"LONGITUDE","Longitude east.","http://vocab.nerc.ac.uk/collection/OG1/current/LON/","false","degree_east","Degrees east","http://vocab.nerc.ac.uk/collection/P06/current/DEGE/"
"PHYCOERYTHRIN","Phycoerythrin concentration per unit volume of fresh or salt water.","http://vocab.nerc.ac.uk/collection/OG1/current/PHYC/","false","ng/l","Nanograms per litre","http://vocab.nerc.ac.uk/collection/P06/current/UNGL/"
"BBP532","Particle backscattering at 532 nanometers.","http://vocab.nerc.ac.uk/collection/OG1/current/BBP532/","false","/m","per metre","http://vocab.nerc.ac.uk/collection/P06/current/UPRM/"
"FDOM","The quantity of the optically measurable component of coloured (chromophoric) dissolved organic matter (CDOM) that fluoresces when excited with near ultra-violet (UV) light, measured in a unit volume of salt water by calibration against a quinine sulphate proxy. Often referred to as fluorescent dissolved organic matter (FDOM) when expressed as quinine sulphate equivalent.","http://vocab.nerc.ac.uk/collection/OG1/current/FDOM/","false","ppb","Parts per billion","http://vocab.nerc.ac.uk/collection/P06/current/UPPB/"
"DOWN_IRRADIANCE380","The vertical component of light at 380nm wavelength travelling downwards.","http://vocab.nerc.ac.uk/collection/OG1/current/ED380/","false","W/m^2/nm","Watts per square metre per nanometre","http://vocab.nerc.ac.uk/collection/P06/current/UWNM/"
"THETA","Potential temperature of the water body by computation using UNESCO 1983 algorithm.","http://vocab.nerc.ac.uk/collection/OG1/current/THETA/","false","degC","Degrees Celsius","http://vocab.nerc.ac.uk/collection/P06/current/UPAA/"
"TEMP_CNDC","Internal temperature (degC) of the conductivity cell.","http://vocab.nerc.ac.uk/collection/OG1/current/TEMP_CNDC/","false","degC","Degrees Celsius","http://vocab.nerc.ac.uk/collection/P06/current/UPAA/"
"TEMP_DOXY","Temperature of oxygen determination by optode.","http://vocab.nerc.ac.uk/collection/OG1/current/TEMPDOXY/","false","degC","Degrees Celsius","http://vocab.nerc.ac.uk/collection/P06/current/UPAA/"
"OXYSAT_DOXY","Saturation of oxygen {O2 CAS 7782-44-7} in the water body [dissolved plus reactive particulate phase] by in-situ oxygen optode and computation from concentration.","http://vocab.nerc.ac.uk/collection/OG1/current/OXYSAT/","false","%","Percent","http://vocab.nerc.ac.uk/collection/P06/current/UPCT/"
"SOUNDVEL","The rate at which sound travels through the water column.","http://vocab.nerc.ac.uk/collection/OG1/current/SOUNDVEL/","false","m/s","Metres per second","http://vocab.nerc.ac.uk/collection/P06/current/UVAA/"
"WATER_VELOC_FINAL_V","The depth-averaged current in the y-axis using dead reckoning between two surfacings. Corrected for surface drift while the glider receives its first GPS fix at the surface.","http://vocab.nerc.ac.uk/collection/OG1/current/WATER_VELOC_FINAL_V/","false","m/s","Metres per second","http://vocab.nerc.ac.uk/collection/P06/current/UVAA/"
"WATER_VELOC_FINAL_U","The depth-averaged current in the x-axis using dead reckoning between two surfacings. Corrected for surface drift while the glider receives its first GPS fix at the surface.","http://vocab.nerc.ac.uk/collection/OG1/current/WATER_VELOC_FINAL_U/","false","m/s","Metres per second","http://vocab.nerc.ac.uk/collection/P06/current/UVAA/"
"DPHASE_DOXY","D phase is calculated as a third degree polynomial of (the phase angle measured by blue excitation light minus the phase angle measured by red excitation light).","http://vocab.nerc.ac.uk/collection/OG1/current/DPHDOXY/","false","deg","Degrees","http://vocab.nerc.ac.uk/collection/P06/current/UAAA/"
"BPHASE_DOXY","Uncalibrated blue excitation light phase shift reported by oxygen sensor.","http://vocab.nerc.ac.uk/collection/OG1/current/BPHDOXY/","false","deg","Degrees","http://vocab.nerc.ac.uk/collection/P06/current/UAAA/"
"GLIDER_ROLL","The tilting rotation of a platform relative to its longitudinal/X axis as measured by an inclinometer.","http://vocab.nerc.ac.uk/collection/OG1/current/ROLL/","false","deg","Degrees","http://vocab.nerc.ac.uk/collection/P06/current/UAAA/"
"RPHASE_DOXY","Uncalibrated red excitation light phase shift reported by oxygen sensor.","http://vocab.nerc.ac.uk/collection/OG1/current/RPHDOXY/","false","deg","Degrees","http://vocab.nerc.ac.uk/collection/P06/current/UAAA/"
"GLIDER_HEADING","The rotation of a platform relative to its upward/Z axis relative to magnetic north. Often referred to as yaw or bearing.","http://vocab.nerc.ac.uk/collection/OG1/current/HEADING/","false","deg","Degrees","http://vocab.nerc.ac.uk/collection/P06/current/UAAA/"
"TPHASE_DOXY","Uncalibrated (temperature compensated) phase shift reported by oxygen sensor.","http://vocab.nerc.ac.uk/collection/OG1/current/TPHDOXY/","false","deg","Degrees","http://vocab.nerc.ac.uk/collection/P06/current/UAAA/"
"GLIDER_PITCH","The up/down rotation of a platform relative to it Y axis as measured by an inclinometer.","http://vocab.nerc.ac.uk/collection/OG1/current/PITCH/","false","deg","Degrees","http://vocab.nerc.ac.uk/collection/P06/current/UAAA/"
"GLIDER_HEADING_TN","The rotation of a platform relative to its upward/Z axis relative to True North. Often referred to as yaw or bearing.","http://vocab.nerc.ac.uk/collection/OG1/current/HEADINGTN/","false","deg","Degrees","http://vocab.nerc.ac.uk/collection/P06/current/UAAA/"
"SIGMA_THETA","Sigma-theta of the water body and computation from salinity and potential temperature using UNESCO algorithm.","http://vocab.nerc.ac.uk/collection/OG1/current/SIGTHETA/","false","kg/m^3","Kilograms per cubic metre","http://vocab.nerc.ac.uk/collection/P06/current/UKMC/"
"POTDENS_SURFACE","Potential density of the water body by computation from salinity and theta using UNESCO algorithm with 0 decibar reference pressure","http://vocab.nerc.ac.uk/collection/OG1/current/POTDENS0/","false","kg/m^3","Kilograms per cubic metre","http://vocab.nerc.ac.uk/collection/P06/current/UKMC/"
"DENSITY","The mass of a unit volume of any body of fresh or salt water.","http://vocab.nerc.ac.uk/collection/OG1/current/DENSITY/","false","kg/m^3","Kilograms per cubic metre","http://vocab.nerc.ac.uk/collection/P06/current/UKMC/"
"SIGMA_T","Computed by UNESCO SVAN function using in-situ temperature.","http://vocab.nerc.ac.uk/collection/OG1/current/SIGMA_T/","false","kg/m^3","Kilograms per cubic metre","http://vocab.nerc.ac.uk/collection/P06/current/UKMC/"
"RAW_DOWNWELLING_IRRADIANCE380","The raw output expressed in counts from an upward-facing cosine collector radiometer for optical wavelength 380nm.","http://vocab.nerc.ac.uk/collection/OG1/current/EDLAM380/","false","Dmnless","Dimensionless","http://vocab.nerc.ac.uk/collection/P06/current/UUUU/"
"RAW_STDEV_TURB_SHEAR","The square root of the average of the squares of deviations about the mean of counts in the water body by a turbulence profiler shear sensor.","http://vocab.nerc.ac.uk/collection/OG1/current/RSHEAR_SD/","false","Dmnless","Dimensionless","http://vocab.nerc.ac.uk/collection/P06/current/UUUU/"
"RAW_DOWNWELLING_IRRADIANCE443","The raw output expressed in counts from an upward-facing cosine collector radiometer for optical wavelength 443nm.","http://vocab.nerc.ac.uk/collection/OG1/current/EDLAM443/","false","Dmnless","Dimensionless","http://vocab.nerc.ac.uk/collection/P06/current/UUUU/"
"RAW_STDEV_TURB_THERMISTOR_2","The square root of the average of the squares of deviations about the mean of counts in the water body by a second turbulence profiler thermistor.","http://vocab.nerc.ac.uk/collection/OG1/current/RTHERTUR_SD2/","false","Dmnless","Dimensionless","http://vocab.nerc.ac.uk/collection/P06/current/UUUU/"
"ENERGYLEVEL_ALTIMETER","Intensity of the echo return from an altimeter, ranging from 0 to 1. A value of 1 represents full saturation of the receiver. An energy level of 0.707 (square root of 2) is the theoretical perfect level as it represents the energy of a pure sine wave with an amplitude utilising the maximum dynamic range of the receiver.","http://vocab.nerc.ac.uk/collection/OG1/current/ENLEVEL/","false","Dmnless","Dimensionless","http://vocab.nerc.ac.uk/collection/P06/current/UUUU/"
"TEMP_CPU_RADIOM","The raw analogue-to-digital converter output from a temperature sensor mounted on a CPU that is a component part of a radiometer.","http://vocab.nerc.ac.uk/collection/OG1/current/TCPURADP/","false","Dmnless","Dimensionless","http://vocab.nerc.ac.uk/collection/P06/current/UUUU/"
"GLIDER_COMMAND_PHASE","Glider command phase.","http://vocab.nerc.ac.uk/collection/OG1/current/GLCOMPH/","false","Dmnless","Dimensionless","http://vocab.nerc.ac.uk/collection/P06/current/UUUU/"
"RAW_STDEV_TURB_THERMISTOR","The square root of the average of the squares of deviations about the mean of counts in the water body by a turbulence profiler thermistor.","http://vocab.nerc.ac.uk/collection/OG1/current/RTHERTUR_SD/","false","Dmnless","Dimensionless","http://vocab.nerc.ac.uk/collection/P06/current/UUUU/"
"PSAL","Practical salinity of the water body by CTD and computation using UNESCO 1983 algorithm","http://vocab.nerc.ac.uk/collection/OG1/current/PSAL/","false","Dmnless","Dimensionless","http://vocab.nerc.ac.uk/collection/P06/current/UUUU/"
"RAW_MEAN_TURB_THERMISTOR_2","The average number of counts in the water body across multiple measurements by a second turbulence profiler thermistor.","http://vocab.nerc.ac.uk/collection/OG1/current/RTHERTUR_MN2/","false","Dmnless","Dimensionless","http://vocab.nerc.ac.uk/collection/P06/current/UUUU/"
"TEMP_COUNT_DOXY","Count which is expressive of uncalibrated temperature value reported by oxygen sensor.","http://vocab.nerc.ac.uk/collection/OG1/current/TCNTDOXY/","false","Dmnless","Dimensionless","http://vocab.nerc.ac.uk/collection/P06/current/UUUU/"
"RAW_MEAN_TURB_THERMISTOR","The average number of counts in the water body across multiple measurements by a turbulence profiler thermistor.","http://vocab.nerc.ac.uk/collection/OG1/current/RTHERTUR_MN/","false","Dmnless","Dimensionless","http://vocab.nerc.ac.uk/collection/P06/current/UUUU/"
"GLIDER_VBD_COUNT","The variable buoyancy device (VBD) A/D count position of a glider.","http://vocab.nerc.ac.uk/collection/OG1/current/VBD/","false","Dmnless","Dimensionless","http://vocab.nerc.ac.uk/collection/P06/current/UUUU/"
"RAW_DOWNWELLING_IRRADIANCE","The raw output expressed in counts from an upward-facing cosine collector radiometer for one unspecified wavelength from the measured spectrum.","http://vocab.nerc.ac.uk/collection/OG1/current/EDLAM/","false",NA,NA,NA
"RAW_DOWNWELLING_IRRADIANCE490","The raw output expressed in counts from an upward-facing cosine collector radiometer for optical wavelength 490nm.","http://vocab.nerc.ac.uk/collection/OG1/current/EDLAM490/","false","Dmnless","Dimensionless","http://vocab.nerc.ac.uk/collection/P06/current/UUUU/"
"CORRELATIONFACTOR_ALTIMETER","Quality of the echo return from an altimeter, ranging from 0 to 1. A value of 1 represents a perfect return echo with negligible noise and distortion.","http://vocab.nerc.ac.uk/collection/OG1/current/COR_FACT/","false","Dmnless","Dimensionless","http://vocab.nerc.ac.uk/collection/P06/current/UUUU/"
"RAW_DOWNWELLING_IRRADIANCE555","The raw output expressed in counts from an upward-facing cosine collector radiometer for optical wavelength 555nm.","http://vocab.nerc.ac.uk/collection/OG1/current/EDLAM555/","false","Dmnless","Dimensionless","http://vocab.nerc.ac.uk/collection/P06/current/UUUU/"
"GLIDER_ROLL_MASS_POSITION_COUNT","The roll A/D count position of a glider internal mass.","http://vocab.nerc.ac.uk/collection/OG1/current/ROLMPOS/","false","Dmnless","Dimensionless","http://vocab.nerc.ac.uk/collection/P06/current/UUUU/"
"CONFIGURED_GLIDER_ROLL_MASS_POSITION","The angle of a glider's internal roll mass from the position that would maintain neutral roll (Positive starboard wing down).","http://vocab.nerc.ac.uk/collection/OG1/current/CROLMPOS/","false","Dmnless","Dimensionless","http://vocab.nerc.ac.uk/collection/P06/current/UUUU/"
"RAW_STDEV_TURB_SHEAR_2","The square root of the average of the squares of deviations about the mean of counts in the water body by a second turbulence profiler shear sensor.","http://vocab.nerc.ac.uk/collection/OG1/current/RSHEAR_SD2/","false","Dmnless","Dimensionless","http://vocab.nerc.ac.uk/collection/P06/current/UUUU/"
"RAW_DOWNWELLING_IRRADIANCE412","The raw output expressed in counts from an upward-facing cosine collector radiometer for optical wavelength 412nm.","http://vocab.nerc.ac.uk/collection/OG1/current/EDLAM412/","false","Dmnless","Dimensionless","http://vocab.nerc.ac.uk/collection/P06/current/UUUU/"
"ENGINEERING_CYCLE_NUMBER","Engineering data cycle number.","http://vocab.nerc.ac.uk/collection/OG1/current/CYCLEENG/","false","Dmnless","Dimensionless","http://vocab.nerc.ac.uk/collection/P06/current/UUUU/"
"FLUORESCENCE_PHYCOERYTHRIN","Phycoerythrin signal from a fluorescence sensor.","http://vocab.nerc.ac.uk/collection/OG1/current/FLUOPHYC/","false","Dmnless","Dimensionless","http://vocab.nerc.ac.uk/collection/P06/current/UUUU/"
"FLUORESCENCE_CDOM","The amount of violet to low ultra-violet radiation generated in the water column in response to high ultra-violet radiation transmission expressed relative to an unspecified baseline using fluorometer designed to detect CDOM, crude oil or UV-fluorescent dyes.","http://vocab.nerc.ac.uk/collection/OG1/current/FLUOCDOM/","false","Dmnless","Dimensionless","http://vocab.nerc.ac.uk/collection/P06/current/UUUU/"
"LED_FLASHING_COUNT_DOXY","Number of times oxygen sensor flashing to measure oxygen.","http://vocab.nerc.ac.uk/collection/OG1/current/LCNTDOXY/","false","Dmnless","Dimensionless","http://vocab.nerc.ac.uk/collection/P06/current/UUUU/"
"RAW_DOWNWELLING_PAR","The raw output expressed in counts from an upward-facing cosine collector radiometer measuring the integrated light over PAR wavelengths.","http://vocab.nerc.ac.uk/collection/OG1/current/RAWDPAR/","false","Dmnless","Dimensionless","http://vocab.nerc.ac.uk/collection/P06/current/UUUU/"
